{
  "media_type": "movie",
  "title": "A Brief History of Time",
  "year": 1991,
  "tmdb_id": 1358,
  "tvdb_id": 17170,
  "imdb_id": "tt0103882",
  "poster_url": "https://image.tmdb.org/t/p/original/xhiY97Ckf00s9VbOwZrkBFQYWH3.jpg",
  "background_url": "https://artworks.thetvdb.com/banners/movies/17170/backgrounds/17170.jpg",
  "youtube_id": "XukF7Xr9pGE"
}
