{
  "media_type": "movie",
  "title": "'71",
  "year": 2014,
  "tmdb_id": 252178,
  "tvdb_id": 4092,
  "imdb_id": "tt2614684",
  "poster_url": "https://image.tmdb.org/t/p/original/jDwABpleLf99agBpQmp95QyOWTM.jpg",
  "background_url": "https://image.tmdb.org/t/p/original/77SDDm01LGEJkZoT55pzP8tO6K2.jpg",
  "youtube_id": "mO-vbGVbav4"
}
