{
  "media_type": "movie",
  "title": "1984",
  "year": 1984,
  "tmdb_id": 9314,
  "tvdb_id": 5369,
  "imdb_id": "tt0087803",
  "poster_url": "https://image.tmdb.org/t/p/original/brvLMSAJ3smt6Es6jZwZI07MY4X.jpg",
  "background_url": "https://image.tmdb.org/t/p/original/iiYCg63DJ0w7pLdJmAmj9xCfQzw.jpg",
  "youtube_id": "F43DqnMoWi0"
}
