{
  "media_type": "movie",
  "title": "A Clockwork Orange",
  "year": 1971,
  "tmdb_id": 185,
  "tvdb_id": 641,
  "imdb_id": "tt0066921",
  "poster_url": "https://image.tmdb.org/t/p/original/mDXkPY0EbyrhOlRAX5np9ywg4Si.jpg",
  "background_url": "https://image.tmdb.org/t/p/original/a4xb2R1u4i1YO9EmfSD1P7DjTKZ.jpg",
  "youtube_id": "Yd8-73EvIeg"
}
