{
  "media_type": "movie",
  "title": "12 Angry Men",
  "year": 1957,
  "tmdb_id": 389,
  "tvdb_id": 572,
  "imdb_id": "tt0050083",
  "poster_url": "https://image.tmdb.org/t/p/original/maGiVq0dWiZr61HMI2DHoARwDJJ.jpg",
  "background_url": "https://image.tmdb.org/t/p/original/p1nBxgrSu9Ex0Uvci1ItWWCWPlk.jpg",
  "youtube_id": "iv6ux4rpGdc"
}
