{
  "media_type": "movie",
  "title": "Scanners",
  "year": 1981,
  "tmdb_id": 9538,
  "tvdb_id": 4923,
  "imdb_id": "tt0081455",
  "poster_url": "https://image.tmdb.org/t/p/original/yWdYqWRGYPYAh1UIIG2UUmWY6df.jpg",
  "background_url": "https://image.tmdb.org/t/p/original/6b0fZkf6LHgokpBRn16tG0KncGC.jpg",
  "youtube_id": "clVRKF74UXY"
}
