{
  "media_type": "movie",
  "title": "Project Hail Mary",
  "year": 2026,
  "tmdb_id": 687163,
  "tvdb_id": 346729,
  "imdb_id": "tt12042730",
  "poster_url": "https://image.tmdb.org/t/p/original/AdpvqIhgaqg5JHzH3M6532XV3PG.jpg",
  "background_url": "https://image.tmdb.org/t/p/original/ckgitpsGKUFVO8yHinQdKSSyrFC.jpg",
  "youtube_id": "d4yvEC9Bu5g"
}
