{
  "media_type": "show",
  "title": "Apocalypse: Hitler Takes on the East",
  "year": 2021,
  "tmdb_id": 286449,
  "tvdb_id": 411287,
  "imdb_id": "tt15524930",
  "poster_url": "https://image.tmdb.org/t/p/original/mnlfxYXxFDavsYecKDCewMUvGXo.jpg",
  "background_url": "https://image.tmdb.org/t/p/original/q3SOEXNl07Lw19e2gfGBQVDWuqj.jpg",
  "youtube_id": null,
  "seasons": [
    {
      "season_num": 1,
      "poster_url": "https://theposterdb.com/api/assets/709903"
    }
  ]
}
