{
  "media_type": "movie",
  "title": "A Serious Man",
  "year": 2009,
  "tmdb_id": 12573,
  "tvdb_id": 5443,
  "imdb_id": "tt1019452",
  "poster_url": "https://image.tmdb.org/t/p/original/sU9MMiCKmPL7jjk0TjiT056RN9m.jpg",
  "background_url": "https://image.tmdb.org/t/p/original/6j3YrwkG4TZo8oNR4U4SDpql4pP.jpg",
  "youtube_id": "6xxpejY9hug"
}
