{
  "media_type": "show",
  "title": "True Detective",
  "year": 2014,
  "tmdb_id": 46648,
  "tvdb_id": 270633,
  "imdb_id": "tt2356777",
  "poster_url": "https://theposterdb.com/api/assets/37517",
  "background_url": "https://image.tmdb.org/t/p/original/8IrYdrfBKZ1GVAnxRaJrzxRzi1J.jpg",
  "youtube_id": "p4zluA60hjs",
  "seasons": [
    {
      "season_num": 1,
      "poster_url": "https://image.tmdb.org/t/p/original/gVkx2L06re7YeM5qrn5woWClOLJ.jpg"
    }
  ]
}
