{
  "media_type": "movie",
  "title": "Army of Shadows",
  "year": 1969,
  "tmdb_id": 15383,
  "tvdb_id": 9347,
  "imdb_id": "tt0064040",
  "poster_url": "https://image.tmdb.org/t/p/original/iVkgOdv87sQgNPb7URePF6b7Nry.jpg",
  "background_url": "https://image.tmdb.org/t/p/original/f8NNC7BFIYbuv9Fix3x3ZYcftAV.jpg",
  "youtube_id": "5WHqX8ht32Y"
}
