{
  "media_type": "movie",
  "title": "Normal",
  "year": 2026,
  "tmdb_id": 1242332,
  "tvdb_id": 362089,
  "imdb_id": "tt31195136",
  "poster_url": "https://image.tmdb.org/t/p/original/rsNdDcCKjCZm9RBMAxL3vMUokKU.jpg",
  "background_url": "https://image.tmdb.org/t/p/original/kHdFlyJEHZq2vJDGDW5crp3d9Jv.jpg",
  "youtube_id": null
}
