{
  "media_type": "show",
  "title": "11.22.63",
  "year": 2016,
  "tmdb_id": 64464,
  "tvdb_id": 301824,
  "imdb_id": "tt2879552",
  "poster_url": "https://image.tmdb.org/t/p/original/1fH41ccMKvgDTbbcCxWWH6fznah.jpg",
  "background_url": "https://image.tmdb.org/t/p/original/4Tkc9Tj58jKZDYwcVC83qzzA9z.jpg",
  "youtube_id": "Ztq0yVj7Z6A",
  "seasons": [
    {
      "season_num": 1,
      "poster_url": "https://image.tmdb.org/t/p/original/8pXetQ89MUJ2LX1IkKoldBWXyfj.jpg"
    }
  ]
}
